{
  "all_figures_nonblank": true,
  "all_sources_hashed": true,
  "blank_figures": [],
  "figure_count": 60,
  "missing_figures": [],
  "missing_sources": [],
  "ok": true,
  "rows": [
    {
      "byte_size": 380445,
      "caption": "Graphical abstract for the source-bounded software chain. Labeled zones map the source paper, finite equation registry, QRF boundary screen, simulation engines, and claim gates; the central screen shows relabelings over one bitstream without turning them into empirical, clinical, neural, practice-efficacy, or physical qFEP evidence.",
      "channels": 4,
      "exists": true,
      "height": 2520,
      "id": "graphical_abstract_cover",
      "nonblank": true,
      "path": "output/figures/graphical_abstract_cover.png",
      "pixel_variance": 0.02375528997930658,
      "sha256": "61b0f917e2119959376c878e297216db5b93e9e667a6fbf51c9e7d3e1df1db68",
      "source_artifacts": [
        {
          "byte_size": 14340,
          "exists": true,
          "path": "output/data/source_claim_crosswalk.json",
          "sha256": "3476f2c1aef5f5148ac5bfdc5878db8d928197ad531be6a5552f42447ca73d44"
        },
        {
          "byte_size": 13204,
          "exists": true,
          "path": "output/data/equation_audit.json",
          "sha256": "665094ab25441cdb03c0eeb6ac51e3f1a6c495772e7336f634491f6a30eb5332"
        },
        {
          "byte_size": 14183,
          "exists": true,
          "path": "output/data/qrf_boundary_indistinguishability.json",
          "sha256": "d3cb2c14d6756d0c16a928572cbcc3c85c968e0b8c691a0ccc9f17f5bbd0d168"
        },
        {
          "byte_size": 25768787,
          "exists": true,
          "path": "output/data/stochastic_policy_ensemble.json",
          "sha256": "b17bb5c9884e6c73122247161a9f99bd7cfe18e8b339b6d187d0115a50a41865"
        },
        {
          "byte_size": 533307,
          "exists": true,
          "path": "output/data/quantum_trajectory_unraveling.json",
          "sha256": "2c5e6b1ffb1bcd1e74fab9b8faf3c7fafac1904c8c7efbd5d40ddb9fe0cb03bb"
        },
        {
          "byte_size": 44435,
          "exists": true,
          "path": "output/data/gnn_model_audit.json",
          "sha256": "2e113c1d2dd728a05f7cd5f3c7edcf68f9d94eb2136bd81df7fbbcab09050a75"
        }
      ],
      "width": 3024
    },
    {
      "byte_size": 267493,
      "caption": "Finite QRF boundary-screen geometry for the lead boundary result. Dashed screen, node labels, action edge, observation edge, and channel-role text show how b0-b5 function as software observation channels while preserving the boundary claim that no node or edge is empirical, biological, ontological self/world, or physical qFEP evidence.",
      "channels": 4,
      "exists": true,
      "height": 1453,
      "id": "qrf_boundary_screen_geometry",
      "nonblank": true,
      "path": "output/figures/qrf_boundary_screen_geometry.png",
      "pixel_variance": 0.018468481211983235,
      "sha256": "fa8a95d2c8aa357a3e19097fb5f6872f66da8dea3f258d3f341c58f25b2b2ba0",
      "source_artifacts": [
        {
          "byte_size": 13855,
          "exists": true,
          "path": "output/data/pymdp_profile_comparison.json",
          "sha256": "41af984185a71873f19c784075ed92aed3f26b7b5b33fead7e02801b554a4b7b"
        },
        {
          "byte_size": 14183,
          "exists": true,
          "path": "output/data/qrf_boundary_indistinguishability.json",
          "sha256": "d3cb2c14d6756d0c16a928572cbcc3c85c968e0b8c691a0ccc9f17f5bbd0d168"
        },
        {
          "byte_size": 6724,
          "exists": true,
          "path": "output/data/qrf_boundary_channel_ledger.json",
          "sha256": "891aba4a29743399f347c4f9df0257b59f4af218c92ff7bcb104174dc59dc29a"
        },
        {
          "byte_size": 44435,
          "exists": true,
          "path": "output/data/gnn_model_audit.json",
          "sha256": "2e113c1d2dd728a05f7cd5f3c7edcf68f9d94eb2136bd81df7fbbcab09050a75"
        }
      ],
      "width": 2487
    },
    {
      "byte_size": 204973,
      "caption": "b0-b5 QRF channel relabeling ledger for equations 7-10. The invariant same-bit row marks each evidenced boundary bit, while profile rows relabel those unchanged channels as self, env, action, body, world, other, or care; colors and text encode software sectors only and are not evidence for an ontological self/world boundary.",
      "channels": 4,
      "exists": true,
      "height": 1309,
      "id": "qrf_channel_relabeling_ledger",
      "nonblank": true,
      "path": "output/figures/qrf_channel_relabeling_ledger.png",
      "pixel_variance": 0.06898870831054703,
      "sha256": "a0207bdd9fe113551520bdd9a7ec66b522c7283b2c583880dcfb547ec89eab1d",
      "source_artifacts": [
        {
          "byte_size": 6724,
          "exists": true,
          "path": "output/data/qrf_boundary_channel_ledger.json",
          "sha256": "891aba4a29743399f347c4f9df0257b59f4af218c92ff7bcb104174dc59dc29a"
        },
        {
          "byte_size": 14183,
          "exists": true,
          "path": "output/data/qrf_boundary_indistinguishability.json",
          "sha256": "d3cb2c14d6756d0c16a928572cbcc3c85c968e0b8c691a0ccc9f17f5bbd0d168"
        },
        {
          "byte_size": 44435,
          "exists": true,
          "path": "output/data/gnn_model_audit.json",
          "sha256": "2e113c1d2dd728a05f7cd5f3c7edcf68f9d94eb2136bd81df7fbbcab09050a75"
        }
      ],
      "width": 3136
    },
    {
      "byte_size": 214533,
      "caption": "QRF invariance and policy-flow audit over the same finite screen. Panel A shows admissible deployments at normalized probability mass with a separate failing perturbation-control marker; Panel B shows profile-specific selected actions from the pymdp trace. The figure supports finite software validation only, not empirical, biological, ontological, or physical qFEP evidence.",
      "channels": 4,
      "exists": true,
      "height": 1264,
      "id": "qrf_invariance_policy_flow",
      "nonblank": true,
      "path": "output/figures/qrf_invariance_policy_flow.png",
      "pixel_variance": 0.09054857496055435,
      "sha256": "2a33e106163784d8e7131e00e8c3381d35dbe3162c62b1eefa72bd1baf4d37cb",
      "source_artifacts": [
        {
          "byte_size": 13855,
          "exists": true,
          "path": "output/data/pymdp_profile_comparison.json",
          "sha256": "41af984185a71873f19c784075ed92aed3f26b7b5b33fead7e02801b554a4b7b"
        },
        {
          "byte_size": 14183,
          "exists": true,
          "path": "output/data/qrf_boundary_indistinguishability.json",
          "sha256": "d3cb2c14d6756d0c16a928572cbcc3c85c968e0b8c691a0ccc9f17f5bbd0d168"
        },
        {
          "byte_size": 44435,
          "exists": true,
          "path": "output/data/gnn_model_audit.json",
          "sha256": "2e113c1d2dd728a05f7cd5f3c7edcf68f9d94eb2136bd81df7fbbcab09050a75"
        }
      ],
      "width": 3378
    },
    {
      "byte_size": 76781,
      "caption": "Boundary-channel sector labels for the separation-constrained, opacified, and post-dual QRF profiles. The color legend maps each sector label to a categorical color, making the finite relabeling surrogate visible without treating sector color as physical quantum-boundary evidence.",
      "channels": 4,
      "exists": true,
      "height": 638,
      "id": "qrf_sectorisation_map",
      "nonblank": true,
      "path": "output/figures/qrf_sectorisation_map.png",
      "pixel_variance": 0.05556055545495501,
      "sha256": "08622255b0e8d3bf203a130af362d74f4e120892ab7768838f867c79ac05c140",
      "source_artifacts": [
        {
          "byte_size": 13855,
          "exists": true,
          "path": "output/data/pymdp_profile_comparison.json",
          "sha256": "41af984185a71873f19c784075ed92aed3f26b7b5b33fead7e02801b554a4b7b"
        },
        {
          "byte_size": 44435,
          "exists": true,
          "path": "output/data/gnn_model_audit.json",
          "sha256": "2e113c1d2dd728a05f7cd5f3c7edcf68f9d94eb2136bd81df7fbbcab09050a75"
        }
      ],
      "width": 1875
    },
    {
      "byte_size": 85923,
      "caption": "Probability mass remains normalized and label-invariant across admissible QRF sectorisations, while a deliberately perturbed negative control fails the audit. The bar color legend and dashed reference line support only the finite boundary-indistinguishability claim recorded in the source crosswalk.",
      "channels": 4,
      "exists": true,
      "height": 875,
      "id": "boundary_indistinguishability",
      "nonblank": true,
      "path": "output/figures/boundary_indistinguishability.png",
      "pixel_variance": 0.09898457747763519,
      "sha256": "bb5016f1e77b98ee70ea8be1f2bcb302f6045a7abbebd1c1956fe2d5d341f5ff",
      "source_artifacts": [
        {
          "byte_size": 14183,
          "exists": true,
          "path": "output/data/qrf_boundary_indistinguishability.json",
          "sha256": "d3cb2c14d6756d0c16a928572cbcc3c85c968e0b8c691a0ccc9f17f5bbd0d168"
        },
        {
          "byte_size": 44435,
          "exists": true,
          "path": "output/data/gnn_model_audit.json",
          "sha256": "2e113c1d2dd728a05f7cd5f3c7edcf68f9d94eb2136bd81df7fbbcab09050a75"
        }
      ],
      "width": 1984
    },
    {
      "byte_size": 306036,
      "caption": "QRF reference-frame geometry over the finite boundary screen. Node colors identify sector labels, dashed circle marks the boundary screen, and action/observation edge colors show the active-inference loop; the figure is a finite surrogate map, not empirical or quantum-dynamical evidence.",
      "channels": 4,
      "exists": true,
      "height": 1452,
      "id": "qrf_reference_frame_geometry",
      "nonblank": true,
      "path": "output/figures/qrf_reference_frame_geometry.png",
      "pixel_variance": 0.021147702891344995,
      "sha256": "ece1fbfa4c52948334111bdcbb18d32af202fad7e4ffdc92b9a40a8546752d0d",